title;grupo
Assessing the Economic Impact of Forest Management in the Brazilian Amazon Through Real Options Analysis;triado
Solutions Based on Nature to Face Water Stress: Lessons from the Past and Present;triado
Assessing the Economic Impact of Forest Management in the Brazilian Amazon Through Real Options Analysis;novo
Sustainability of Shade-Grown Erva-Mate Production: A Management Framework for Forest Conservation;novo
Solutions Based on Nature to Face Water Stress: Lessons from the Past and Present;novo
